{
  "$schema": "https://json-schema.org/draft/2020-12/schema",
  "$id": "https://raw.githubusercontent.com/SurfaceWorks/Codex/main/schema/role-registry.schema.json",
  "title": "Codex Role Registry",
  "description": "Schema for the open, recommended-not-required Codex role vocabulary. A role is the semantic MEANING of a control (what it is, not how it draws). The registry data (roles.json) is the authoritative machine artifact; docs/reference/*-role-registry.md is its human narration. This schema validates the SHAPE of each entry, not the closed set of allowed roles — the vocabulary is open (grow by PR; a product may use `unmapped` or a vendor role and still render).",
  "type": "object",
  "required": ["registry", "version", "roles"],
  "additionalProperties": false,
  "properties": {
    "registry": {
      "type": "string",
      "const": "codex.roles",
      "description": "Registry discriminator — identifies this document as the Codex role registry."
    },
    "version": {
      "type": "string",
      "pattern": "^[0-9]+\\.[0-9]+\\.[0-9]+$",
      "description": "Registry version (semver). Grows additively — entries are added, never removed or repurposed."
    },
    "status": {
      "type": "string",
      "enum": ["prototype", "stable"],
      "default": "prototype",
      "description": "Maturity of the vocabulary as a whole. 'prototype' = we believe this is close to the final shape, but building consumers (SurfaceWorks/Lucidity, DeckLibre) against it may still force BREAKING changes. 'stable' = an owner-triggered commitment that the vocabulary only ever GROWS from here — additive-only, never shrinks or repurposes an entry. Everything is 'prototype' until the consumer apps are closer to done."
    },
    "notes": {
      "type": "string",
      "description": "Free-form registry-level note (e.g. provenance, relationship to the contract)."
    },
    "roles": {
      "type": "array",
      "description": "The role vocabulary. Open and growable; order is not significant.",
      "items": { "$ref": "#/$defs/role" }
    }
  },
  "$defs": {
    "role": {
      "type": "object",
      "description": "One semantic role in the Codex vocabulary.",
      "required": ["role", "group", "nature", "accessibleFallback"],
      "additionalProperties": false,
      "properties": {
        "role": {
          "type": "string",
          "description": "Open role identifier. Standard roles use lowercase_snake; a vendor role uses a tail 'x.<vendor>.<name>'. This names the semantic meaning of a control; the meaning's binding to descriptor semantics is owned by the CommonTongue contract and only referenced here, never redefined.",
          "pattern": "^(x\\.[a-z0-9]+\\.[a-z0-9_]+|[a-z][a-z0-9_]*)$",
          "minLength": 1
        },
        "group": {
          "type": "string",
          "description": "Domain grouping this role belongs to, which also implies its surface kind: 'universal', 'lighting', 'metering', 'camera' are device-control-surface roles; 'deck_affordance', 'deck_binding' are deck/input-surface roles; 'pro_av' spans both (a pro-AV surface reflects host state and emits).",
          "enum": ["universal", "lighting", "metering", "camera", "deck_affordance", "deck_binding", "pro_av"]
        },
        "nature": {
          "type": "string",
          "description": "The role's coarse capability kind: 'settable' = a property a client sets · 'readonly' = telemetry a client only observes · 'action' = a momentary thing a client fires. This is the ROLE-level fact. It does NOT state read-write vs write-only — that is a per-DEVICE fact owned by the CommonTongue descriptor (PropertyPayload.Access: READ_ONLY / READ_WRITE / WRITE_ONLY) together with the value Confidence axis (CONFIRMED / COMMANDED for a write-only device). The same role is read-write on a device that reports back and write-only on one that does not (e.g. a write-only fixture); Codex therefore does not — and cannot honestly — pin that here. Referenced, never restated (single-source-of-truth).",
          "enum": ["settable", "readonly", "action"]
        },
        "label": {
          "type": "string",
          "description": "Optional short human-readable name for the role."
        },
        "description": {
          "type": "string",
          "description": "Optional longer human description of the role's meaning."
        },
        "accessibleFallback": {
          "type": "string",
          "description": "REQUIRED accessibility/interop floor. The generic role a renderer treats this as when it does not recognise the specific role — so an unknown role still renders as a named, fully-operable, accessible control (never a nameless box). This is a first-class accessible rendering, not a lesser one. Standard fallbacks: 'unmapped' (generic), or a nearer universal role. A universal role may point to itself or to 'unmapped'. Must reference a role that exists in this registry (integrity-checked by scripts/check-registry.py).",
          "pattern": "^[a-z][a-z0-9_]*$",
          "minLength": 1
        },
        "gatedBy": {
          "type": "string",
          "description": "Optional role whose value gates this role's applicability (mode-gating), e.g. lighting colour roles gated by `color_mode`. Must reference another role identifier.",
          "pattern": "^[a-z][a-z0-9_]*$"
        },
        "aliases": {
          "type": "array",
          "description": "Optional alternate role spellings this role also answers to (e.g. 'online' alongside 'connection_health').",
          "items": { "type": "string", "pattern": "^[a-z][a-z0-9_]*$" }
        },
        "notes": {
          "type": "string",
          "description": "Free-form per-entry note."
        }
      }
    }
  }
}
