{
  "registry": "codex.roles",
  "version": "0.1.0",
  "status": "prototype",
  "notes": "The recommended cross-vendor role vocabulary — the semantic meaning of a control. Seeded from a 2026-07-19 five-domain control-surface research sweep (lighting control · light meters · streaming/macro decks · virtual/touch surfaces · pro-AV/DAW/grading) + CameraConductor's verified [V] camera vocabulary. Recommended, not required; a product may use `unmapped` or a vendor role (x.<vendor>.<name>) and still render; grow by PR. nature (coarse ROLE-level capability): settable=a property a client sets, readonly=telemetry a client observes, action=a momentary thing a client fires. nature does NOT state read-write vs write-only — that is a per-DEVICE fact owned by the CommonTongue descriptor (PropertyPayload.Access READ_ONLY/READ_WRITE/WRITE_ONLY + the value Confidence axis CONFIRMED/COMMANDED). The role's group implies its surface kind (universal/lighting/metering/camera=device-control; deck_affordance/deck_binding=deck-input; pro_av=both). The value model (scalar/compound/array), mode-gating, and read/write/confidence are all owned by the CommonTongue contract and only referenced here, never restated. Every entry carries a required accessibleFallback — the first-class accessible rendering for an unrecognised role.",
  "roles": [
    {
      "role": "on_off",
      "group": "universal",
      "nature": "settable",
      "accessibleFallback": "unmapped"
    },
    {
      "role": "identify",
      "group": "universal",
      "nature": "action",
      "accessibleFallback": "unmapped"
    },
    {
      "role": "reset",
      "group": "universal",
      "nature": "action",
      "accessibleFallback": "unmapped"
    },
    {
      "role": "device_label",
      "group": "universal",
      "nature": "settable",
      "accessibleFallback": "unmapped"
    },
    {
      "role": "power_state",
      "group": "universal",
      "nature": "settable",
      "accessibleFallback": "unmapped"
    },
    {
      "role": "battery_level",
      "group": "universal",
      "nature": "readonly",
      "accessibleFallback": "unmapped"
    },
    {
      "role": "temperature",
      "group": "universal",
      "nature": "readonly",
      "accessibleFallback": "unmapped"
    },
    {
      "role": "connection_health",
      "group": "universal",
      "nature": "readonly",
      "aliases": [
        "online"
      ],
      "accessibleFallback": "unmapped"
    },
    {
      "role": "signal_status",
      "group": "universal",
      "nature": "readonly",
      "accessibleFallback": "unmapped"
    },
    {
      "role": "device_status",
      "group": "universal",
      "nature": "readonly",
      "aliases": [
        "error_flags"
      ],
      "accessibleFallback": "unmapped"
    },
    {
      "role": "firmware_version",
      "group": "universal",
      "nature": "readonly",
      "accessibleFallback": "unmapped"
    },
    {
      "role": "intensity",
      "group": "lighting",
      "nature": "settable",
      "notes": "= dimmer",
      "accessibleFallback": "unmapped"
    },
    {
      "role": "intensity_min",
      "group": "lighting",
      "nature": "settable",
      "accessibleFallback": "unmapped"
    },
    {
      "role": "intensity_max",
      "group": "lighting",
      "nature": "settable",
      "accessibleFallback": "unmapped"
    },
    {
      "role": "dimmer_curve",
      "group": "lighting",
      "nature": "settable",
      "accessibleFallback": "unmapped"
    },
    {
      "role": "dimming_speed",
      "group": "lighting",
      "nature": "settable",
      "accessibleFallback": "unmapped"
    },
    {
      "role": "pwm_frequency",
      "group": "lighting",
      "nature": "settable",
      "accessibleFallback": "unmapped"
    },
    {
      "role": "shutter",
      "group": "lighting",
      "nature": "settable",
      "notes": "open/closed",
      "accessibleFallback": "unmapped"
    },
    {
      "role": "strobe",
      "group": "lighting",
      "nature": "settable",
      "notes": "Hz",
      "accessibleFallback": "unmapped"
    },
    {
      "role": "strobe_mode",
      "group": "lighting",
      "nature": "settable",
      "accessibleFallback": "unmapped"
    },
    {
      "role": "color_mode",
      "group": "lighting",
      "nature": "settable",
      "notes": "hsi|cct|rgb(w)|xy|gel|cmy — gates the colour roles below",
      "accessibleFallback": "unmapped"
    },
    {
      "role": "hue",
      "group": "lighting",
      "nature": "settable",
      "gatedBy": "color_mode",
      "accessibleFallback": "unmapped"
    },
    {
      "role": "saturation",
      "group": "lighting",
      "nature": "settable",
      "gatedBy": "color_mode",
      "accessibleFallback": "unmapped"
    },
    {
      "role": "color_rgb",
      "group": "lighting",
      "nature": "settable",
      "gatedBy": "color_mode",
      "accessibleFallback": "unmapped"
    },
    {
      "role": "red",
      "group": "lighting",
      "nature": "settable",
      "gatedBy": "color_mode",
      "accessibleFallback": "unmapped"
    },
    {
      "role": "green",
      "group": "lighting",
      "nature": "settable",
      "gatedBy": "color_mode",
      "accessibleFallback": "unmapped"
    },
    {
      "role": "blue",
      "group": "lighting",
      "nature": "settable",
      "gatedBy": "color_mode",
      "accessibleFallback": "unmapped"
    },
    {
      "role": "white",
      "group": "lighting",
      "nature": "settable",
      "gatedBy": "color_mode",
      "accessibleFallback": "unmapped"
    },
    {
      "role": "warm_white",
      "group": "lighting",
      "nature": "settable",
      "gatedBy": "color_mode",
      "accessibleFallback": "unmapped"
    },
    {
      "role": "cool_white",
      "group": "lighting",
      "nature": "settable",
      "gatedBy": "color_mode",
      "accessibleFallback": "unmapped"
    },
    {
      "role": "amber",
      "group": "lighting",
      "nature": "settable",
      "gatedBy": "color_mode",
      "accessibleFallback": "unmapped"
    },
    {
      "role": "lime",
      "group": "lighting",
      "nature": "settable",
      "gatedBy": "color_mode",
      "accessibleFallback": "unmapped"
    },
    {
      "role": "cyan",
      "group": "lighting",
      "nature": "settable",
      "gatedBy": "color_mode",
      "accessibleFallback": "unmapped"
    },
    {
      "role": "indigo",
      "group": "lighting",
      "nature": "settable",
      "gatedBy": "color_mode",
      "accessibleFallback": "unmapped"
    },
    {
      "role": "uv",
      "group": "lighting",
      "nature": "settable",
      "gatedBy": "color_mode",
      "accessibleFallback": "unmapped"
    },
    {
      "role": "color_xy",
      "group": "lighting",
      "nature": "settable",
      "gatedBy": "color_mode",
      "accessibleFallback": "unmapped"
    },
    {
      "role": "color_temperature",
      "group": "lighting",
      "nature": "settable",
      "gatedBy": "color_mode",
      "accessibleFallback": "unmapped"
    },
    {
      "role": "tint",
      "group": "lighting",
      "nature": "settable",
      "gatedBy": "color_mode",
      "accessibleFallback": "unmapped"
    },
    {
      "role": "cmy_cyan",
      "group": "lighting",
      "nature": "settable",
      "gatedBy": "color_mode",
      "accessibleFallback": "unmapped"
    },
    {
      "role": "cmy_magenta",
      "group": "lighting",
      "nature": "settable",
      "gatedBy": "color_mode",
      "accessibleFallback": "unmapped"
    },
    {
      "role": "cmy_yellow",
      "group": "lighting",
      "nature": "settable",
      "gatedBy": "color_mode",
      "accessibleFallback": "unmapped"
    },
    {
      "role": "color_wheel",
      "group": "lighting",
      "nature": "settable",
      "gatedBy": "color_mode",
      "accessibleFallback": "unmapped"
    },
    {
      "role": "gel_select",
      "group": "lighting",
      "nature": "settable",
      "gatedBy": "color_mode",
      "accessibleFallback": "unmapped"
    },
    {
      "role": "color_preset",
      "group": "lighting",
      "nature": "settable",
      "gatedBy": "color_mode",
      "accessibleFallback": "unmapped"
    },
    {
      "role": "pan",
      "group": "lighting",
      "nature": "settable",
      "accessibleFallback": "unmapped"
    },
    {
      "role": "tilt",
      "group": "lighting",
      "nature": "settable",
      "accessibleFallback": "unmapped"
    },
    {
      "role": "pan_tilt",
      "group": "lighting",
      "nature": "settable",
      "accessibleFallback": "unmapped"
    },
    {
      "role": "pan_tilt_speed",
      "group": "lighting",
      "nature": "settable",
      "accessibleFallback": "unmapped"
    },
    {
      "role": "pan_continuous",
      "group": "lighting",
      "nature": "settable",
      "accessibleFallback": "unmapped"
    },
    {
      "role": "tilt_continuous",
      "group": "lighting",
      "nature": "settable",
      "accessibleFallback": "unmapped"
    },
    {
      "role": "pan_invert",
      "group": "lighting",
      "nature": "settable",
      "accessibleFallback": "unmapped"
    },
    {
      "role": "tilt_invert",
      "group": "lighting",
      "nature": "settable",
      "accessibleFallback": "unmapped"
    },
    {
      "role": "zoom",
      "group": "lighting",
      "nature": "settable",
      "accessibleFallback": "unmapped"
    },
    {
      "role": "focus",
      "group": "lighting",
      "nature": "settable",
      "accessibleFallback": "unmapped"
    },
    {
      "role": "iris",
      "group": "lighting",
      "nature": "settable",
      "accessibleFallback": "unmapped"
    },
    {
      "role": "frost",
      "group": "lighting",
      "nature": "settable",
      "accessibleFallback": "unmapped"
    },
    {
      "role": "framing_blade",
      "group": "lighting",
      "nature": "settable",
      "accessibleFallback": "unmapped"
    },
    {
      "role": "gobo_select",